{"schema_version":"1","generated_at":"2026-10-25T08:18:27+00:00","connections":[{"marketplace_account_id":"01a17223-6bcd-760d-8d59-572b04926d04","company_id":"01a17223-6b9a-7edc-a843-97bab61ee1a9","provider":"ozon","updated_at":"2026-10-25T08:18:06+00:00","credentials":{"seller":{"client_id":"client-e2e-out","api_key":"key-e2e-out"},"performance":null},"resource_types":["ozon.finance.accrual-by-day","ozon.orders.fbo","ozon.products.list","ozon.products.info"]}],"next_cursor":null}