{"schema_version":"1","generated_at":"2026-10-25T08:18:27+00:00","connections":[{"marketplace_account_id":"01a17223-68d8-7223-b10a-82c83f9fb302","company_id":"01a17223-68a1-710d-930c-81725af79833","provider":"ozon","updated_at":"2026-10-25T08:18:05+00:00","credentials":{"seller":{"client_id":"client-e2e-a","api_key":"key-e2e-a"},"performance":null},"resource_types":["ozon.finance.accrual-by-day","ozon.orders.fbo","ozon.products.list","ozon.products.info"]},{"marketplace_account_id":"01a17223-6a5e-7d18-8386-87eefe058450","company_id":"01a17223-6a2c-774b-bd36-4ec0857f2bbc","provider":"ozon","updated_at":"2026-10-25T08:18:06+00:00","credentials":{"seller":{"client_id":"client-cab-401","api_key":"key-cab-401"},"performance":null},"resource_types":["ozon.finance.accrual-by-day","ozon.orders.fbo","ozon.products.list","ozon.products.info"]}],"next_cursor":"MDFhMTcyMjMtNmE1ZS03ZDE4LTgzODYtODdlZWZlMDU4NDUw"}